{
  "protocol_version": 1,
  "type": "audit_page",
  "request_id": "audit-1",
  "room_revision": 9,
  "payload": {
    "entries": [
      {
        "id": 12,
        "room_revision": 9,
        "actor_id": "member-1",
        "event_type": "comment_accepted",
        "details": {"comment_id": "comment-1", "line_id": "9K3MT7Q2CD-1"},
        "created_at": "2026-07-14T10:01:00Z"
      }
    ],
    "next_after_id": 12
  }
}
